{
  "version": "2025.10",
  "name": "globex",
  "sets": {
    "core": {
      "sources": [
        {
          "$ref": "core.json"
        }
      ]
    },
    "palette": {
      "sources": [
        {
          "$ref": "globex/palette.json"
        }
      ]
    }
  },
  "modifiers": {
    "sub-theme": {
      "default": "standard",
      "contexts": {
        "standard": [
          {
            "$ref": "globex/sub-theme/standard.json"
          }
        ]
      }
    },
    "color-scheme": {
      "default": "light",
      "contexts": {
        "light": [
          {
            "$ref": "scheme/light.json"
          }
        ],
        "dark": [
          {
            "$ref": "scheme/dark.json"
          }
        ]
      }
    }
  },
  "resolutionOrder": [
    {
      "$ref": "#/sets/core"
    },
    {
      "$ref": "#/sets/palette"
    },
    {
      "$ref": "#/modifiers/sub-theme"
    },
    {
      "$ref": "#/modifiers/color-scheme"
    }
  ]
}
