{
  "version": "2025.10",
  "name": "Default",
  "sets": {
    "core": {
      "sources": [
        {
          "$ref": "core.json"
        }
      ]
    }
  },
  "modifiers": {
    "theme": {
      "contexts": {
        "light": [
          {
            "$ref": "light.json"
          }
        ],
        "dark": [
          {
            "$ref": "dark.json"
          }
        ]
      },
      "default": "light"
    }
  },
  "resolutionOrder": [
    {
      "$ref": "#/sets/core"
    },
    {
      "$ref": "#/modifiers/theme"
    }
  ]
}
